{"project_id":"demo-short","currency":"USD","budget_total":5.0,"drift_alert_pct":30,"stages":[{"stage":"shot_lock","estimate":0.5,"actual":0.45,"revision_cap":2,"revisions":1,"items":[{"kind":"model_tokens","model":"director@pinned","tokens_in":40000,"tokens_out":3000,"amount":0.45}]},{"stage":"render_preview","estimate":0.2,"actual":0.31,"revision_cap":3,"revisions":4,"items":[{"kind":"render_minutes","minutes":6,"amount":0.31}]}]}
